{
	"$schema": "https://raw.githubusercontent.com/delacournz/delacour-ui/main/registry/item.schema.json",
	"name": "provider",
	"type": "registry:ui",
	"title": "Provider",
	"description": "The root provider: safe-area insets seeded from the launch snapshot, and gesture handling.",
	"categories": [
		"primitives"
	],
	"registryDependencies": [
		"use-keyboard-state-sync"
	],
	"dependencies": [],
	"expoDependencies": [
		"react-native-gesture-handler",
		"react-native-keyboard-controller",
		"react-native-safe-area-context"
	],
	"devDependencies": [],
	"files": [
		{
			"path": "packages/react-native-ui/src/components/provider/AGENTS.md",
			"target": "provider/AGENTS.md",
			"namespace": "ui",
			"rewrites": [
				{
					"from": "@delacour/react-native-ui/provider",
					"to": "@registry/ui/provider"
				}
			]
		},
		{
			"path": "packages/react-native-ui/src/components/provider/index.ts",
			"target": "provider/index.ts",
			"namespace": "ui"
		},
		{
			"path": "packages/react-native-ui/src/components/provider/provider.tsx",
			"target": "provider/provider.tsx",
			"namespace": "ui",
			"rewrites": [
				{
					"from": "../../hooks/use-keyboard-state-sync",
					"to": "@registry/hooks/use-keyboard-state-sync"
				},
				{
					"from": "@delacour/react-native-ui/bottom-sheet",
					"to": "@registry/ui/bottom-sheet"
				},
				{
					"from": "@delacour/react-native-ui/provider",
					"to": "@registry/ui/provider"
				}
			]
		}
	]
}
