{
	"$schema": "https://raw.githubusercontent.com/delacournz/delacour-ui/main/registry/item.schema.json",
	"name": "menu",
	"type": "registry:ui",
	"title": "Menu",
	"description": "A list of actions anchored to the control that opens it — checkbox and radio rows, in-place submenus.",
	"categories": [
		"controls"
	],
	"registryDependencies": [
		"compose-refs",
		"icon",
		"icons",
		"pressable",
		"separator",
		"slot",
		"text",
		"tv",
		"use-controllable-state"
	],
	"dependencies": [
		"tailwind-variants"
	],
	"expoDependencies": [
		"react-native-gesture-handler",
		"react-native-reanimated",
		"react-native-safe-area-context",
		"react-native-worklets"
	],
	"devDependencies": [],
	"files": [
		{
			"path": "packages/react-native-ui/src/components/menu/AGENTS.md",
			"target": "menu/AGENTS.md",
			"namespace": "ui",
			"rewrites": [
				{
					"from": "@delacour/react-native-ui/menu",
					"to": "@registry/ui/menu"
				}
			]
		},
		{
			"path": "packages/react-native-ui/src/components/menu/index.ts",
			"target": "menu/index.ts",
			"namespace": "ui"
		},
		{
			"path": "packages/react-native-ui/src/components/menu/menu-background.tsx",
			"target": "menu/menu-background.tsx",
			"namespace": "ui"
		},
		{
			"path": "packages/react-native-ui/src/components/menu/menu-checkbox-item.tsx",
			"target": "menu/menu-checkbox-item.tsx",
			"namespace": "ui",
			"rewrites": [
				{
					"from": "../../hooks/use-controllable-state",
					"to": "@registry/hooks/use-controllable-state"
				},
				{
					"from": "../../icons/central",
					"to": "@registry/icons/central"
				},
				{
					"from": "../icon",
					"to": "@registry/ui/icon"
				}
			]
		},
		{
			"path": "packages/react-native-ui/src/components/menu/menu-content.tsx",
			"target": "menu/menu-content.tsx",
			"namespace": "ui",
			"rewrites": [
				{
					"from": "../pressable",
					"to": "@registry/ui/pressable"
				}
			]
		},
		{
			"path": "packages/react-native-ui/src/components/menu/menu-item.tsx",
			"target": "menu/menu-item.tsx",
			"namespace": "ui",
			"rewrites": [
				{
					"from": "../icon",
					"to": "@registry/ui/icon"
				},
				{
					"from": "../pressable/pressable",
					"to": "@registry/ui/pressable/pressable"
				},
				{
					"from": "../text",
					"to": "@registry/ui/text"
				}
			]
		},
		{
			"path": "packages/react-native-ui/src/components/menu/menu-label.tsx",
			"target": "menu/menu-label.tsx",
			"namespace": "ui",
			"rewrites": [
				{
					"from": "../text",
					"to": "@registry/ui/text"
				}
			]
		},
		{
			"path": "packages/react-native-ui/src/components/menu/menu-radio-group.tsx",
			"target": "menu/menu-radio-group.tsx",
			"namespace": "ui",
			"rewrites": [
				{
					"from": "../../hooks/use-controllable-state",
					"to": "@registry/hooks/use-controllable-state"
				}
			]
		},
		{
			"path": "packages/react-native-ui/src/components/menu/menu-radio-item.tsx",
			"target": "menu/menu-radio-item.tsx",
			"namespace": "ui",
			"rewrites": [
				{
					"from": "../../icons/central",
					"to": "@registry/icons/central"
				},
				{
					"from": "../icon",
					"to": "@registry/ui/icon"
				}
			]
		},
		{
			"path": "packages/react-native-ui/src/components/menu/menu-separator.tsx",
			"target": "menu/menu-separator.tsx",
			"namespace": "ui",
			"rewrites": [
				{
					"from": "../separator",
					"to": "@registry/ui/separator"
				}
			]
		},
		{
			"path": "packages/react-native-ui/src/components/menu/menu-sub-content.tsx",
			"target": "menu/menu-sub-content.tsx",
			"namespace": "ui"
		},
		{
			"path": "packages/react-native-ui/src/components/menu/menu-sub-trigger.tsx",
			"target": "menu/menu-sub-trigger.tsx",
			"namespace": "ui",
			"rewrites": [
				{
					"from": "../../icons/central",
					"to": "@registry/icons/central"
				},
				{
					"from": "../icon",
					"to": "@registry/ui/icon"
				}
			]
		},
		{
			"path": "packages/react-native-ui/src/components/menu/menu-sub.tsx",
			"target": "menu/menu-sub.tsx",
			"namespace": "ui",
			"rewrites": [
				{
					"from": "../../hooks/use-controllable-state",
					"to": "@registry/hooks/use-controllable-state"
				}
			]
		},
		{
			"path": "packages/react-native-ui/src/components/menu/menu-trigger.tsx",
			"target": "menu/menu-trigger.tsx",
			"namespace": "ui",
			"rewrites": [
				{
					"from": "../../lib/compose-refs",
					"to": "@registry/lib/compose-refs"
				},
				{
					"from": "../../lib/slot",
					"to": "@registry/lib/slot"
				},
				{
					"from": "../pressable",
					"to": "@registry/ui/pressable"
				}
			]
		},
		{
			"path": "packages/react-native-ui/src/components/menu/menu.context.tsx",
			"target": "menu/menu.context.tsx",
			"namespace": "ui",
			"rewrites": [
				{
					"from": "../../hooks/use-controllable-state",
					"to": "@registry/hooks/use-controllable-state"
				},
				{
					"from": "../pressable/pressable",
					"to": "@registry/ui/pressable/pressable"
				}
			]
		},
		{
			"path": "packages/react-native-ui/src/components/menu/menu.tsx",
			"target": "menu/menu.tsx",
			"namespace": "ui",
			"rewrites": [
				{
					"from": "../pressable/pressable",
					"to": "@registry/ui/pressable/pressable"
				}
			]
		},
		{
			"path": "packages/react-native-ui/src/components/menu/menu.types.ts",
			"target": "menu/menu.types.ts",
			"namespace": "ui",
			"rewrites": [
				{
					"from": "../icon/icon",
					"to": "@registry/ui/icon/icon"
				}
			]
		},
		{
			"path": "packages/react-native-ui/src/components/menu/menu.variants.ts",
			"target": "menu/menu.variants.ts",
			"namespace": "ui",
			"rewrites": [
				{
					"from": "../../lib/tv",
					"to": "@registry/lib/tv"
				}
			]
		}
	],
	"tests": [
		{
			"path": "packages/react-native-ui/src/components/menu/menu.variants.test.ts",
			"target": "menu/menu.variants.test.ts",
			"namespace": "ui",
			"rewrites": [
				{
					"from": "../../styles/theme-tokens.test",
					"to": "@registry/styles/theme-tokens.test"
				}
			]
		}
	],
	"testRegistryDependencies": [
		"styles"
	],
	"testDependencies": [
		"@types/bun"
	]
}
