{
	"$schema": "https://raw.githubusercontent.com/delacournz/delacour-ui/main/registry/item.schema.json",
	"name": "merge-props",
	"type": "registry:lib",
	"title": "mergeProps",
	"description": "Merges slot props onto a child's own.",
	"registryDependencies": [
		"cn"
	],
	"dependencies": [],
	"expoDependencies": [],
	"devDependencies": [],
	"files": [
		{
			"path": "packages/react-native-ui/src/lib/merge-props.ts",
			"target": "merge-props.ts",
			"namespace": "lib"
		}
	],
	"tests": [
		{
			"path": "packages/react-native-ui/src/lib/merge-props.test.ts",
			"target": "merge-props.test.ts",
			"namespace": "lib"
		}
	],
	"testDependencies": [
		"@types/bun"
	]
}
