{
	"$schema": "https://raw.githubusercontent.com/delacournz/delacour-ui/main/registry/item.schema.json",
	"name": "map",
	"type": "registry:ui",
	"title": "Map",
	"description": "A themed MapLibre map on a token-painted basemap: markers, pins, labels, popups, routes, arcs and controls, with a camera ref.",
	"categories": [
		"display"
	],
	"registryDependencies": [
		"button",
		"icon",
		"icons",
		"surface",
		"text",
		"tv",
		"use-theme-color"
	],
	"dependencies": [
		"tailwind-variants"
	],
	"expoDependencies": [
		"@maplibre/maplibre-react-native",
		"react-native-reanimated",
		"react-native-svg"
	],
	"devDependencies": [],
	"files": [
		{
			"path": "packages/react-native-ui/src/components/map/AGENTS.md",
			"target": "map/AGENTS.md",
			"namespace": "ui",
			"rewrites": [
				{
					"from": "@delacour/react-native-ui/map",
					"to": "@registry/ui/map"
				}
			]
		},
		{
			"path": "packages/react-native-ui/src/components/map/index.ts",
			"target": "map/index.ts",
			"namespace": "ui"
		},
		{
			"path": "packages/react-native-ui/src/components/map/map-arc.tsx",
			"target": "map/map-arc.tsx",
			"namespace": "ui",
			"rewrites": [
				{
					"from": "../../hooks/use-theme-color",
					"to": "@registry/hooks/use-theme-color"
				}
			]
		},
		{
			"path": "packages/react-native-ui/src/components/map/map-controls.tsx",
			"target": "map/map-controls.tsx",
			"namespace": "ui",
			"rewrites": [
				{
					"from": "../../icons/central",
					"to": "@registry/icons/central"
				},
				{
					"from": "../button",
					"to": "@registry/ui/button"
				},
				{
					"from": "../icon",
					"to": "@registry/ui/icon"
				},
				{
					"from": "../surface",
					"to": "@registry/ui/surface"
				}
			]
		},
		{
			"path": "packages/react-native-ui/src/components/map/map-geometry.ts",
			"target": "map/map-geometry.ts",
			"namespace": "ui"
		},
		{
			"path": "packages/react-native-ui/src/components/map/map-label.tsx",
			"target": "map/map-label.tsx",
			"namespace": "ui",
			"rewrites": [
				{
					"from": "../surface",
					"to": "@registry/ui/surface"
				},
				{
					"from": "../text",
					"to": "@registry/ui/text"
				}
			]
		},
		{
			"path": "packages/react-native-ui/src/components/map/map-marker.tsx",
			"target": "map/map-marker.tsx",
			"namespace": "ui"
		},
		{
			"path": "packages/react-native-ui/src/components/map/map-pin.tsx",
			"target": "map/map-pin.tsx",
			"namespace": "ui",
			"rewrites": [
				{
					"from": "../../hooks/use-theme-color",
					"to": "@registry/hooks/use-theme-color"
				}
			]
		},
		{
			"path": "packages/react-native-ui/src/components/map/map-popup.tsx",
			"target": "map/map-popup.tsx",
			"namespace": "ui",
			"rewrites": [
				{
					"from": "../../hooks/use-theme-color",
					"to": "@registry/hooks/use-theme-color"
				},
				{
					"from": "../surface",
					"to": "@registry/ui/surface"
				},
				{
					"from": "../text",
					"to": "@registry/ui/text"
				}
			]
		},
		{
			"path": "packages/react-native-ui/src/components/map/map-route.tsx",
			"target": "map/map-route.tsx",
			"namespace": "ui",
			"rewrites": [
				{
					"from": "../../hooks/use-theme-color",
					"to": "@registry/hooks/use-theme-color"
				}
			]
		},
		{
			"path": "packages/react-native-ui/src/components/map/map-user-location.tsx",
			"target": "map/map-user-location.tsx",
			"namespace": "ui",
			"rewrites": [
				{
					"from": "../../hooks/use-theme-color",
					"to": "@registry/hooks/use-theme-color"
				}
			]
		},
		{
			"path": "packages/react-native-ui/src/components/map/map.context.tsx",
			"target": "map/map.context.tsx",
			"namespace": "ui"
		},
		{
			"path": "packages/react-native-ui/src/components/map/map.tsx",
			"target": "map/map.tsx",
			"namespace": "ui",
			"rewrites": [
				{
					"from": "../../hooks/use-theme-color",
					"to": "@registry/hooks/use-theme-color"
				}
			]
		},
		{
			"path": "packages/react-native-ui/src/components/map/map.types.ts",
			"target": "map/map.types.ts",
			"namespace": "ui"
		},
		{
			"path": "packages/react-native-ui/src/components/map/map.variants.ts",
			"target": "map/map.variants.ts",
			"namespace": "ui",
			"rewrites": [
				{
					"from": "../../lib/tv",
					"to": "@registry/lib/tv"
				}
			]
		}
	]
}
